{
  "claim_id": "C-example-0001",
  "run_id": "run-2026-10-07-example",
  "agent": "02-verifier",
  "claim": "Synthetic example: the sum of the three sample invoice lines equals the sample invoice total.",
  "kind": "number",
  "value": 300.0,
  "unit": "CAD",
  "evidence": [
    {
      "type": "computation",
      "ref": "scripts/sum_lines.py",
      "locator": "sample-invoice.csv rows 1-3",
      "retrieved_at": "2026-10-07T18:30:00-04:00",
      "script": "scripts/sum_lines.py"
    }
  ],
  "verification": {
    "method": "recomputed",
    "verifier": "02-verifier",
    "verified_at": "2026-10-07T18:31:00-04:00",
    "result": "pass"
  },
  "status": "verified",
  "confidence": "high",
  "created_at": "2026-10-07T18:30:00-04:00"
}
