{
  "claim_id": "C-rc-out",
  "run_id": "run-fixture",
  "agent": "fixture-producer",
  "claim": "Synthetic: script outside the root.",
  "kind": "number",
  "value": 1.0,
  "unit": "CAD",
  "evidence": [
    {
      "type": "computation",
      "ref": "../../../../etc/hostname",
      "locator": "data",
      "retrieved_at": "2026-10-07T12:00:00-04:00",
      "script": "../../../../etc/hostname"
    }
  ],
  "status": "pending",
  "created_at": "2026-10-07T12:00:00-04:00"
}
