{
  "claim_id": "C-rc-unit",
  "run_id": "run-fixture",
  "agent": "fixture-producer",
  "claim": "Synthetic: hours worked total 15.5 minutes.",
  "kind": "number",
  "value": 15.5,
  "unit": "minutes",
  "evidence": [
    {
      "type": "computation",
      "ref": "scripts/sum_lines.py",
      "locator": "data",
      "retrieved_at": "2026-10-07T12:00:00-04:00",
      "script": "scripts/sum_lines.py"
    }
  ],
  "status": "pending",
  "created_at": "2026-10-07T12:00:00-04:00"
}
