{
  "claim_id": "C-sc-urlok",
  "run_id": "run-fixture",
  "agent": "fixture-producer",
  "claim": "The supplier's order cutoff is 8:00 pm Eastern.",
  "kind": "fact",
  "evidence": [
    {
      "type": "url",
      "ref": "https://supplier.example/ordering",
      "retrieved_at": "2026-10-07T12:00:00-04:00"
    }
  ],
  "status": "pending",
  "created_at": "2026-10-07T12:00:00-04:00"
}
